"406","Crossingbot","981500884017451009","helps guide foxes and other wildlife across roads. (requestbot from @montybasset)","https://pbs.twimg.com/media/DZ792XJXkAAuYNM.jpg","an ovoid robot holding a sign with a picture of a fox on it, beckoning as an antenna on its head flashes.","antenna flash flashes fox foxes head help helps ovoid picture road roads sign wildlife","@montybasset",""
"407","Wheelchairbot","981786273626120197","pushes your chair for you if you get tired out. (requestbot from @transtwill)","https://pbs.twimg.com/media/DaABaPeWAAEMPEE.jpg","a robot shaped like a blimp with dorsal and ventral fins at the back and two large, semi-enclosed fan engines on either side. it has a slightly worrying smile on its little face and is gripping the handles of a wheelchair with its banded arms as it zooms forward.","blimp dorsal engines face fan fin fins handles large push pushes semi side smile ventral wheelchair zoom zooms","@transtwill",""
"408","Chargebot","981859169086201856","heroic robot that comes to your rescue with the power cable when you haven't noticed your phone, laptop or other electronic device is about to die. (requestbot from @salbagski)","https://pbs.twimg.com/media/DaBDtTfWkAA5q-n.jpg","a round robot swinging into frame using a laptop power cable, looking alarmed.","cable device die electron electronic frame heroic laptop phone power rescue round","@salbagski",""
"409","Rockbot","982148001060630528","goes up to eleven. (requestbot from @laidbackinsong)","https://pbs.twimg.com/media/DaFKZcqUwAgOAzh.jpg","a robot in the form of an amp, with slim, jointed arms and legs and a wire trailing from its back. instead of a speaker on its front it has an enormous rectangular mouth with a visible tongue. it has its eyes screwed shut and is pointing with one hand while making the 'metal' symbol with the other.","amp enormous eye eyes form hand metal mouth rectangular shut slim speaker symbol tongue visible wire","@laidbackinsong",""
"410","Breakupbot","982221655161188352","when a relationship ends, outsource the awkward admin - returning stuff, deleting numbers, informing mutual friends, etc. - to your breakupbot. yours and your ex-partner's work together to make everything as painless as possible before they too part ways.","https://pbs.twimg.com/media/DaGNXptU0AQihP7.jpg","two cylindrical robots writing on clipboards as they stand in front of boxes labelled ""sam's stuff"" and ""jamie's stuff"".","box boxes breakupbot clipboard clipboards cylindrical everything friend friends front jamie mutual number numbers painless part partner possible relationship sam stuff way ways work","",""
"411","Changebot","982561429999050752","(cn: grief) there's no easy way to process tragedy. robots can't fix that, but this one reminds you change is life and you must give yourself time to adapt. there's no right way to grieve. things aren't the same, but that doesn't mean they can't ever be good again","https://pbs.twimg.com/media/DaLCaTIW4AMoVec.jpg","a rounded robot sitting with its legs dangling over the edge of a surface, holding out one hand with an expression of sympathy on its face.","adapt chang change cn easy edge express expression face good grief hand life process right surface sympathy thing things time tragedy way","",""
"412","Memebot","982617742930010112","recreate your favourite memes.","https://pbs.twimg.com/media/DaL1Ty7X0AAKYTl.jpg","a version of the 'american chopper argument' meme, consisting of five panels of two small robots arguing about the relative merits of 'meme culture' and its effect on modern politics.","argument chopper culture effect favourite meme memes merit merits modern panel panels politics recreate relative version","",""
"413","Hoarsebot","982913187635957760","when you lose your voice, stands on your shoulder listening intently with its little trumpet, then repeats your words through its megaphone. sometimes gets the two confused.","https://pbs.twimg.com/media/DaQCVVwWsAEiM_8.jpg","a spherical robot standing on someone's shoulder holding a conical funnel pressed to the side of its body in one hand and a tiny megaphone in the other. it has a quizzical expression on its face.","body confused conic conical express expression face funnel hand lose megaphone quizzical shoulder side someone spheric spherical tiny trumpet voice word words","",""
"414","Horsebot","982958892090044416","when developing unicornbot, one of the issues was the horn interface firmware. in order to progress with the project, we made a number of hornless prototypes. so, here's horsebot: it gets a bit sad because it isn't magical but it's still a very good robot.","https://pbs.twimg.com/media/DaQr5oYX0AAGQ8E.jpg","an ovoid robot with four legs and an equine tail. it has a sad expression on its little face.","equine express expression face firmware good horn hornless horsebot interface issues magic magical number order progress project prototypes sad tail unicornbot","",""
"415","Russianbot","983025571562184704","not the kind that meddle in elections. a bit full of themselves.","https://pbs.twimg.com/media/DaRoDiYX0AAGC-3.png","a series of six robots in the form of russian nesting dolls, with the largest 'top half' on the right wearing a furry russian hat and smiling. the rest of the top halves are laid out in descending order of size until, on the far left, the stacked bottom halves have a tiny robot in the middle waving its arms in the air.","air bit bottom doll dolls elect elections form full furry half halves hat kind largest meddle middle nest nesting order right russian series size tiny top wave waving","",""
"416","Wombot","983235432258461697","consumes scrap metal and transforms it into perfect little cubes that can be used to create casings for new small robots (requestbot from @evho315)","https://pbs.twimg.com/media/DaUnaXJXcAA1I1j.jpg","a robot that looks like a wombat with wheels instead of legs. it's eating some bits of scrap metal while a hatch at its rear drops little cubes on the floor.","bit bits case casings consumes cube cubes floor hatch look looks metal new rear transform transforms wheel wheels wombat","@evho315",""
"417","Blessyoubot","983310943605219328","says ""bless you!"" when you sneeze. despite this being its only task, is still always surprised when you do it.","https://pbs.twimg.com/media/DaVsFvrXUAEY3Sf.jpg","a spherical robot with jointed arms and legs, holding its hands to its face with a shocked expression. a speech bubble coming from it shows a large exclamation point.","bless bubble exclamation express expression hand hands large point shock shocked show shows sneeze speech spheric spherical task","",""
"418","Sharpenerbot","983597405080883200","sharpens pencils for you. we're not sure what it does with the shavings. (requestbot from @al_mc72)","https://pbs.twimg.com/media/DaZwn7WXUAA-n22.jpg","a squat, cylindrical robot with a rounded top holding a pencil in one hand while it seemingly chews on another. its whole body is vibrating.","body cylindrical hand pencil pencils sharpen sharpens shave shavings squat sure top whole","@al_mc72",""
"419","Secretbot","983670779421347840","confession, catholics believe, is good for the soul. certainly there is theraputic value in unburdening oneself of shameful memories, and secretbot is here to help. listens, understands, but whatever you tell it will go no further.","https://pbs.twimg.com/media/DaazW6KXcAAwsHE.jpg","an egg-shaped robot sitting down with a quizzical expression. it has no mouth.","catholics confess confession egg express expression good help listen listens memories mouth quizzical secretbot shame shameful soul theraputic understand understands value","",""
"420","Munchiesbot","983960424050757633","goes and gets snack food if you want it for...whatever reason.","https://pbs.twimg.com/media/Dae6yYdWsAARciE.jpg","a tottering round robot overburdened with packaged snacks, some of which have fallen to the ground behind it.","food ground packaged reason round snack snacks","",""
"421","Coldbot","984033976074547201","chills your drinks by means of a wormhole leading to the darkness of the intergalactic void where, unencumbered by even the subtlest kiss of gravity, your coke stays at a frosty 3 degrees kelvin.","https://pbs.twimg.com/media/Daf9rs0WkAIt7XT.jpg","a little fridge with short legs and arms and a face above the door. it's opening itself with one hand, revealing a yawning abyss surrounded by crackling energy, with a galaxy faintly visible in the distance. the other hand is offering a can.","abyss chill chills dark darkness degrees distance door drink drinks energy fridge gravity hand hyperspace intergalactic kiss offer offering short stay stays subtlest visible void wormhole","",""
"422","Cactusbot","984322305215123456","a robot cactus for if you have a single cactus and you're worried it might be lonely  (also provides tips on watering), or if you want a cactus but they slightly freak you out (hello). not spiky.","https://pbs.twimg.com/media/DakD6pNWAAEKu0A.jpg","a little robot in the form of a potted cactus with a little happy face near the top.","cactus face form freak happy hello single spiky tip tips top worried","",""
"423","Threadbarebot","984395524131446784","seeks out your clothes that have seen better days and alerts you to them before you unwittingly put them on and then strut out of the house with your arse on show or something. (requestbot from @rmholdsworth)","https://pbs.twimg.com/media/DalGgodWsAE28ve.jpg","a round-topped robot stands beside a big jumble of clothes, frowningly holding up a pair of much-worn and badly-holed socks.","ars arse big cloth clothes day days house jumble much pair round seek seeks show sock socks something stand stands strut worn","@rmholdsworth",""
"424","Holibot","984686452494741504","really knows how to enjoy itself on holiday. rebranded as vacationbot in north american markets. (requestbot from @princessofvp)","https://pbs.twimg.com/media/DapPF4LX0AAckou.jpg","a round robot lying on a hammock on a beach. it's wearing sunglasses and flip-flops and drinking an elaborate cocktail through a long straw. sandcastlebot is on the ground next to it, playing in the sand with a spade, while in the distance bigbot wades ashore next to a few palm trees.","american beach bigbot cocktail distance elaborate enjoy flip flop flops ground hammock holiday market markets next north palm round sand sandcastlebot spade straw sunglass sunglasses tree trees vacationbot wade wades","@princessofvp",""
"425","Dexteritybot","984758097087467525","for people who have problems with fine motor skills, performs annoying little tasks like lacing and tying shoes. (requestbot from @romluras)","https://pbs.twimg.com/media/DaqQRLFXUAAzH_H.jpg","a spherical robot with jointed arms and legs, kneeling on the floor as it happily laces a shoe.","fine floor motor people perform performs problem problems shoe shoes skill skills spheric spherical task tasks","@romluras",""
"427","Ironbot","985080785798684672","hates creases. filled with grim determination and hot water. dangerously quick so give it some room.","https://pbs.twimg.com/media/Dau1wJ7WkAUT7Mj.jpg","a little robot in the form of an iron with arms and rocket boosters at the back. it's zooming over some creased fabric with a determined expression on its face, one hand clenched into a fist and the other pointing straight forward as if identifying its next target.","booster boosters creases determination express expression fabric face fist form give grim hand hate hates hot iron next quick rocket room straight target water","",""
"428","Ironmanbot","985141449447690240","wanted to be ironman. can't really see out of the helmet, but seems okay about it all.","https://pbs.twimg.com/media/DavswBsWkAIIKIG.png","an ironman helmet with waving robotic arms and legs.","helmet ironman okay robot robotic","",""
"429","Printerbot","985530530723704832","a master wrangler of printers, able to coax a document  from them almost every time and can even sometimes successfully cancel a queued print job!","https://pbs.twimg.com/media/Da1Oa_vW0AIn9KQ.jpg","a spherical robot with jointed arms and legs re-enacting the scene from jurassic world in which chris pratt's character calms down three velociraptors with outstretched palms, except instead of dinosaurs, they're different printer models.","able cancel character chris coax differ different dinosaur dinosaurs document job jurassic master model models palm palms pratt print printer printers scene spheric spherical time velociraptor velociraptors world wrangler","",""
"430","Teebot","985771942933352448","a robotic golf tee. very brave. not to be confused with teabot.","https://pbs.twimg.com/media/Da4qWuQWkAA_XXl.jpg","a robot in the form of a golf tee, with a golf ball balanced on top of it and two little arms.","ball brave confused form golf robot robotic teabot tee top","",""
"431","Tbot","985835726544736256","a robotic t-shirt. very comfortable. not to be confused with teabot or teebot.","https://pbs.twimg.com/media/Da5kXZtW4AEHZ27.jpg","a robot in the form of a t-shirt with a little smiling face in the middle.","comfort comfortable face form middle robot robotic shirt teabot teebot","",""
"432","Fakephonebot","985886407922155521","detects situations you may need an exit from and vibrates; if you then make a pre-arranged signal (like clearing your throat) it starts ringing to give you an excuse to leave. also works as a decoy when giving a fake number. (requestbot from @astrospanner)","https://pbs.twimg.com/media/Da6SdU6WsAEVRzH.jpg","a smartohone with little arms and legs and a worried face above the screen, which shows an incoming call from 'work'.","decoy detect detects excuse exit face fake leave number pre screen signal situations smartohone throat vibrates work worried","@astrospanner",""
"433","Chrisbot","986139368569147392","helps you distinguish between the many white, blondish chrises who have become so ubiquitous in today's media landscape.","https://pbs.twimg.com/media/Da94hroWAAA1rdW.jpg","a potato-shaped robot holding up a picture of thor labelled 'hemsworth' in one hand and captain kirk labelled 'pine' in the other. on the floor are two more pictures, one showing captain america and labelled 'evans' and the other, partially obscured, but showing someone in a shirt and tie and part of the word 'pratt'.","america blondish captain chrises evans floor hand help helps kirk landscape many media part picture pictures pine potato pratt shirt show showing someone thor tie today ubiquitous white word","",""
"434","Hormonesbot","986222597754015744","principally designed for symptoms of menopause, with a fan for hot flashes, tissues for mood swings, lubricant for...you know and hrt pills. also has modes for those transitioning, or undergoing hormone therapy for prostate cancer. (requestbot from @semtexsue)","https://pbs.twimg.com/media/Da_EOHgXcAIcGgw.jpg","a spherical robot held aloft by a propeller on its top and with four arms: one holds a hand fan, another has a tissue, another a container of pills and the last a little bottle of lubricant.it has a sympathetic expression on its face.","aloft bottle cancer contain container express expression face fan flash flashes hand hormone hot hrt last lubricant lubricant.it menopause pill pills propel propeller prostate spheric spherical swing swings sympathetic symptom symptoms therapy tissue tissues top transit transitioning","@semtexsue",""
"435","Fortbot","986494960487804928","has built you a fort! come on in!","https://pbs.twimg.com/media/DbC777dX4AA6pYs.jpg","a round-topped robot pushing aside a sheet draped over what appears to be some dining room furniture, leaning out and waving.","come fort furniture room round sheet wave waving","",""
"436","Connectbot","986574945001136128","you and someone you love each wear one of these robots when you're going to be apart. the robots are always connected and relay noteworthy or evocative experiences to each other in real time that they then share with you. (requestbot from @n0rm, for @totkat)","https://pbs.twimg.com/media/DbECuIXWAAA0VoN.jpg","two identical spherical robots, each hanging from a cord like a necklace, with little arms folded across their fronts below their smiling faces. one robot is looking at big ben, while the other - separated by a wavy line - is looking at the sydney opera house.","ben big cord evocative experiences front fronts house identical line necklace noteworthy opera real relay share someone spheric spherical sydney time wavy wear","@n0rm @totkat",""
"437","Itinerantbot","986856150980268032","if you're sleeping outdoors - by choice or otherwise - this robot unfolds into a roomy little shelter and will keep you safe and cosy. comes bundled with warmbot, signalbot and teabot. (requestbot from @thenotorioussjr)","https://pbs.twimg.com/media/DbIEcABXcAApeu0.jpg","a robot in the form of a dome-shaped tent with a little smiling face above the rolled-up door and small waving arms on either side. visible through the entrance are warmbot, signalbot and teabot, scattered over the integrated ground sheet. a crescent moon hangs over the scene.","bundled choice cosy crescent dome door entrance face form ground hang hangs moon outdoor outdoors safe scene sheet shelter side signalbot teabot tent unfold unfolds visible warmbot wave waving","@thenotorioussjr",""
"438","Jokebot","986925940679815168","has an infallible memory for jokes and loves to re-tell them.","https://pbs.twimg.com/media/DbJD6P_XcAAwMbq.jpg","a round robot laughing uproariously, hands pressed against its body.","body hand hands infallible joke jokes memory round tell","",""
"439","Hospocaloobot","986975920568315904","looks after your little ones when they have to visit hospital, keeping them company, entertaining them, reassuring them and holding their hands when you or a play specialist can't be there. just a fun little round pal generally. (requestbot for @hollybaleen)","https://pbs.twimg.com/media/DbJxHltXkAA4AnO.png","a smiling, egg-shaped robot sitting on the edge of a hospital bed. it is wearing an id-badge on a lanyard and has an antenna with a heart-shaped tip.","badge bed company edge egg hand hands heart hospital id lanyard look looks one ones pal round smile smiling specialist tip","@hollybaleen",""
"440","Cultivationbot","987225927846375424","tends to a specific plant, removing weeds, pests, etc. for use en masse in agriculture so each plant gets individual attention without the need for pesticides or herbicides that result in harmful runoff. (requestbot from @benlkeith)","https://pbs.twimg.com/media/DbNUv40X4AEsMkS.jpg","a bean-shaped robot with jointed arms and legs, wearing little boots and gardening gloves. it's kneeling in a field, plucking a caterpillar from a leaf while depositing another in a small jar filled with bits of grass and a few other caterpillars.","agriculture attention bean bit bits boot boots caterpillar caterpillars field glove gloves grass harm harmful individual jar joint jointed kneel kneeling leaf need pest pesticides pests plant result runoff specific tend tends use weed weeds","@benlkeith",""
"441","Ghostbot","987296705065488385","if you're worried your house may be haunted, deploy this spooky pal to patrol the area. if it meets any ghosts, it will befriend them and keep them away from you so you can get a good night's sleep.","https://pbs.twimg.com/media/DbOVHlNW0AAjybb.jpg","a hovering robot like a sheet draped over something round, with a smiley face on the front.","area face front ghost ghosts good house meet meets night pal patrol round sheet sleep smiley something spooky worried","",""
"442","Frightbot","987596074398486528","scouts ahead and lets you know if you're about to encounter something you have a phobia of. seems to possess some emergent precognitive ability too, which is nice. (requestbot from @hipthorn)","https://pbs.twimg.com/media/DbSlZP0XkAAIsJb.jpg","a spherical robot held aloft by a propeller on its top, pointing behind it with a frightened look on its face. a speech bubble is coming from its mouth with a picture of a snake in it.","ability aloft bubble emergent face frighten frightened let lets look mouth phobia picture possess precognitive propel propeller scout scouts snake something speech spheric spherical top","@hipthorn",""
"444","Carsnackbot","987652356438446080","safely furnishes motorists with snacks and drinks on long drives. (requestbot from @herrbrocktoon)","https://pbs.twimg.com/media/DbTYlD5WAAAuDtW.jpg","a small round robot standing on the passenger seat of a car, offering up a soft drink carton. behind it is an open packet of liquorice all-sorts, spilling out onto the seat.","car carton drink drinks drive drives furnish furnishes liquorice long motorist motorists open packet passenger round seat snack snacks soft sort sorts","@herrbrocktoon",""
"445","TVBot","987797910573273090","always has something good on. (inspired by https://twitter.com/hollybaleen/status/987762054508445697 …)","https://pbs.twimg.com/media/DbVcr61WsAEfWgx.png","a robot in the form of a flat-screen tv, with little arms on either side and legs on the bottom. its face is projected by the screen.","bottom face flat form good hollybaleen http https inspired screen side something status tv twitter.com","",""
"446","Burgerbot","987798361267953664","brings you tasty burgers if what it is you want is tasty burgers. (inspired by https://twitter.com/hollybaleen/status/987762487624904704 …)","https://pbs.twimg.com/media/DbVdJJ5X4AESvzT.png","a low, flat, cuboid robot with four wheels at each corner and a burger on its top.","bring brings burger burgers cuboid flat hollybaleen http https inspired low status tasty top twitter.com wheel wheels","",""
"447","Raspberrybot","988308079589625856","seeks out your enemies and blows raspberries at them.","https://pbs.twimg.com/media/Dbcs9MdXkAAe9yF.jpg","a spherical robot held aloft by a propeller on its top, sticking out its tongue and screwing its eyes shut while it holds its hands up to its ears and waggles its fingers.","aloft ear ears enemies eye eyes finger fingers hand hands propel propeller raspberries seek seeks spheric spherical tongue top","",""
"448","Bouncycastlebot","988412685527277573","if you're having a party outdoors, maybe you'll be lucky enough to see this robot hovering through the air, looking for a place to set down for a few hours before it goes off on its merry way again...","https://pbs.twimg.com/media/DbeMGOQW0AEATAH.jpg","a robot in the form of a bouncy castle, with propellers on each turret and its face on the cross-beam above the entrance.","air beam bouncy castle cross enough entrance face form hour hours merry outdoor outdoors party place propel propellers see way","",""
"449","Showerbot","988672150658867200","wear it in the shower to record your important shower thoughts. later, pop it back on and it will remind you of the ideas you had before it deletes them for security purposes. (requestbot from @adithipandit)","https://pbs.twimg.com/media/Dbh3_kwXcAALzQ-.jpg","a robot in the form of a transparent shower cap, being worn by a person in the shower.","cap form idea ideas import important person purposes record remind security shower thought thoughts transparent wear worn","@adithipandit",""
"450","Warpbot","988746202224254976","save effort when weaving by letting this determined little robot trundle back and forth across your loom setting the warp for you. (requestbot from @patvharris)","https://pbs.twimg.com/media/Dbi7bYZW0AABfh4.jpg","a cube-shaped robot with caterpillar tracks, tugging determinedly on a length of yarn.","caterpillar cube effort forth length loom track tracks trundle warp yarn","@patvharris",""
"453","Balletbot","989401604163031040","if you can't afford expensive ballet lessons for your child, this graceful little robot can give them a solid grounding.","https://pbs.twimg.com/media/DbsPg0uWsAAILwN.jpg","a spherical robot wearing ballet shoes and a tutu, jumping up in the air with its arms raised, eyes closed and a beatific smile on its face.","air ballet beatific expensive eye eyes face grace graceful ground grounding lesson lessons shoe shoes smile solid spheric spherical","",""
"454","Invisibot","989469115525074944","the culmination of our research into transparent components. we haven't had chance to figure out a use for it yet because we keep losing it.","https://pbs.twimg.com/media/DbtM6hkXcAAwIJG.png","a smiley face apparently suspended in mid-air. on the floor below it is the hazy shadow of a waving robot.","air chance components culmination face figure floor hazy keep lose losing mid research shadow smiley transparent use wave waving","",""
"455","Pibot","989759505733844994","knows all the decimal places. will continue reeling them off until the heat death of the universe if you let it.","https://pbs.twimg.com/media/DbxVBS3V4AUpTu8.jpg","a wedge-shaped robot with three legs - one on each corner - and its face on the wide end. a speech bubble coming from it shows pi to 31 decimal places, and counting...","bubble corner count counting death decimal end face heat know knows let place places show shows speech universe wedge wide","",""
"456","Werebot","989833701466017792","a normal guy who shrinks down into a very confused small robot once a month.","https://pbs.twimg.com/media/DbyYgKRW4AA5Fni.jpg","a rather sad-looking robot clambering out of the collar of a crumpled sweater, lying next to some jeans, underpants and socks.","collar guy jean jeans month next normal sad shrink shrinks sock socks sweater underpants","",""
