"266","Pinbot","960855169272614912","a drawing pin that is able to retract its point should it fall to the floor and present a possible hazard (marketed as tackbot in north america).","https://pbs.twimg.com/media/DVWkrk8WkAYRIXi.jpg","a robot in the form of a drawing pin / thumb tack with a smiley face on the end.","able america end face fall floor form hazard north pin point possible present retract smiley tack thumb","",""
"267","Notokaybot","960922339167830021","one of the hardest things about being not okay is talking about it, even to the people who love you the most. it's easier to hide from everyone. notokaybot finds those people and tells them you're not okay for you.","https://pbs.twimg.com/media/DVXhxUOWkAAjHq-.jpg","a little round-topped robot with four little legs, a small antenna and a sad face stands in front of someone.","easier everyone face front hardest hide notokaybot okay people round sad someone tell tells thing things","",""
"268","Sandcastlebot","960970964497465346","helps you make sand castles!","https://pbs.twimg.com/media/DVYN_tHW0AI5IQa.jpg","a happy robot castle-shaped bucket filled with sand on a beach. it's upside-down, with its hands pressed on the ground, about to flip itself over to make a sand castle.","beach bucket castle castles flip ground hand hands happy help helps make sand upside","",""
"269","Auctionbot","961380098132860928","yells at you when you're about to buy something truly, truly foolish on an online auction site (requestbot from @daquifsta)","https://pbs.twimg.com/media/DVeCGg5WsAIDksx.jpg","a laptop open on an ebay listing for 'giant foam lobster l@@k', priced at £500, with a round robot peering around the screen waving a hand with an expression of alarm on its face.","500 alarm auction ebay express expression face foam foolish giant hand k l laptop lobster online open round screen site something yell yells","@daquifsta",""
"270","Newbootsbot","961503104482017280","break in your new boots. we're not sure what shape they are in there... (requestbot from @rosewind2007)","https://pbs.twimg.com/media/DVfx-bQX0AUx9TF.jpg","two ovoid robots, each sitting in one of a pair of boots. they have little arms and propellers on top. one is holding the edge of its boot as it lands on the ground, while the other's boot is in mid-air and it has its arms up and a joyous expression on its face.","air boot boots edge express expression face ground joyous new ovoid pair propel propellers shape sure top","@rosewind2007",""
"271","Phoneretrievalbot","961649476871090176","when you dozily knock your phone off the bedside cabinet down the side of the bed, reaches into the dust and murk to find it again. (requestbot from @wobblygoose)","https://pbs.twimg.com/media/DVh3GbPXcAE6P6Y.jpg","a cylindrical robot hanging from a bedpost, extending one arm down below the level of the quilt. its tongue is sticking out in concentration.","arm bed bedpost bedside cabinet concentration cylindrical dust find hang hanging level murk phone quilt side tongue","@wobblygoose",""
"271","Switchbot","961569213419794433","watches your lights, and if you leave one on when you go out, acts quickly to switch it off. also available in travel size for your car headlights.","https://pbs.twimg.com/media/DVguGciWkAEWT9A.jpg","an ovoid robot standing next to a light switch in the 'on' position, holding a hand over its mouth as it makes a horrified expression.","avail available car express expression go hand headlight headlights light lights mouth next ovoid posit position size switch travel watch watches","",""
"272","Dropoffbot","961707167219945473","sits on your desk in the afternoon and catches you if start to fall asleep.","https://pbs.twimg.com/media/DVirkblW0AAv99S.jpg","a semi-cylindrical robot with four small wheels on its bottom side and two long, snaking arms on either side, reaching up as if to catch something. its face on the front looks alarmed.","afternoon alarm alarmed bottom catch catches cylindrical face front long semi side sit sits something wheel wheels","",""
"274","Remotebot","961901414061617152","locates and retrieves the remote control when it's been eaten by the sofa. (requestbot from @mattcann72)","https://pbs.twimg.com/media/DVlcPCNWAAA1__P.jpg","a dome-shaped robot with four stumpy legs and a little radar dish on its top. it has one long arm snaking from its back which is tipped with a clawed hand. its expression is one of determined annoyance.","annoy annoyance arm control dish dome eaten express expression hand locates long radar retrieves snake snaking sofa stumpy top","@mattcann72",""
"275","Classroombot","961942973503213568","for assisting teachers - not a replacement for an actual ta, but can be programmed to say stuff like, ""read the instructions please!"" and ""don't eat that, it's been up kayleigh's nose!"" (requestbot from @evho315)","https://pbs.twimg.com/media/DVmCCDkXkAAjmb8.jpg","an ovoid robot held aloft by a top-mounted propeller, with jointed arms, one of which is pointing while the other one brandishes a ruler. it appears to be in mid-scold, and it peers over a set of curved reading glasses.","actual brandish brandishes glass glasses instruct instructions kayleigh mid nose ovoid peer peers propel propeller read reading replacement ruler scold stuff ta teacher teachers top","@evho315",""
"276","Trolleybot","962008114932236288","a disc for unlocking trolleys that has little legs so it won't get lost. refuses to go into vending machines though.","https://pbs.twimg.com/media/DVm9RzbVwAEptdW.jpg","a disc-shaped robot with little legs and a small, happy face on the front.","disc face front happy machines refuses trolley trolleys","",""
"277","Logicbot","962053021646577664","helps resolve issues other small robots have with contradictory directives, e.g. helpful robots which don't do anything helpful. (requestbot from @ladytronfashion)","https://pbs.twimg.com/media/DVnmHzwVMAAxue2.jpg","a trapezoid robot wearing glasses holding out its arms as it counsels a bereft-looking toffebot sitting on the floor.","anything contradictory counsel counsels direct directives e.g floor glass glasses help helpful helps issues toffebot trapezoid","@ladytronfashion",""
"278","Crampsbot","962232480400134144","when you're on your period, snuggles up to you in the night and radiates warmth to help sooth cramps.","https://pbs.twimg.com/media/DVqJVs1WkAAs2fn.jpg","a sleeping ovoid robot, curled up next to a sleeping person, with a contented look on its face, with lines indicating radiating heat around it.","cramp cramps face heat line lines look next night ovoid period person snuggles","",""
"279","Transcriptionbot","962298782296797184","plugs straight into a computer's audio jack and transcribes video-only content so you can read it instead of having to put aside time to pay continuous attention to one tab like some caveman.","https://pbs.twimg.com/media/DVrFo6KX4AULxra.jpg","a happy, round-topped robot with no arms sitting on the edge of a desk with a wire running from its side into a laptop's audio jack. a little emitter in the middle of its forehead projects a small holographic window filled with text.","attention audio caveman computer content continuous desk edge emitter forehead happy jack laptop middle pay plug plugs project projects round side tab text time transcribes window wire","",""
"280","Dinnerbot","962383004759937025","comes up with ideas for what you should cook for dinner during the week. (requestbot from @emmah_h)","https://pbs.twimg.com/media/DVsSPTiXUAE0KyF.jpg","a dome-shaped robot with jointed arms and legs, holding up its hands with a big smile. it has a speech bubble with a bowl of steaming food in it.","big bowl bubble cook dinner dome food hand hands idea ideas joint jointed smile speech week","@emmah_h",""
"281","Blueeyesbot","962465076438601728","[cn: suicide, survivor's guilt] if you have lost a loved one to suicide, reminds you every day that it wasn't your fault, that depression is a disease and not every fight is one you can win. (requestbot from @small_affair)","https://pbs.twimg.com/media/DVtcVeXXUAAhPFC.png","a robot with a rounded top and a little antenna bringing a tulip and holding out a hand as it makes an expression of sympathy and understanding. it has a speech bubble with a heart in it.","antenna bubble day depress depression disease express expression fight guilt grief hand heart speech suicide survivor sympathy top tulip understand understanding win","@small_affair",""
"282","Therebot","962466190982598657","[cn: self-harm] is there for you at all times, helping you to not self-harm. holds your hand close to distract you. soothes you with smiles. listens and understands. never judges. (requestbot from @blauerschlumpf_)","https://pbs.twimg.com/media/DVtddfWXcAIxJFE.png","an egg-shaped robot sitting next to a human hand, holding onto the little finger and smiling reassuringly.","close distract finger hand harm human judges listen listens next self smile smiles sooth soothes time times","@blauerschlumpf_",""
"283","Commercialbot","962766231899164684","angrily changes the channel whenever a commercial break comes on. (requestbot from @evho315)","https://pbs.twimg.com/media/DVxuYVTWsAAuSQ5.png","a round robot sitting down with its legs splayed, holding a tv remote in one hand and grumpily jabbing at a button on it with the other.","break button chang changes commercial hand round tv","@evho315",""
"284","Boostbot","962956154560286720","gives you the encouragement you need to do the presentation at work, or whatever other big, brave thing you have to do today. ""you got this!"" (requestbot from @calypte_sarah)","https://pbs.twimg.com/media/DV0bg7lW0AAlK5D.jpg","a robot shaped like a tapering cylinder with a collar and tie encircling it towards its base. its face is smiling and winking as it points with one hand.","base big brave collar cylinder encouragement face hand need point points present presentation thing tie today towards work","@calypte_sarah",""
"285","Recipebot","963031903216525313","is able to reverse-engineer any dish by tasting a sample and provides a full recipe so that you can make it yourself.","https://pbs.twimg.com/media/DV1gZ29W0AAomWd.jpg","an elongated, round robot frowning as it chews a mouthful of something. it holds a finger in the air and has a fork in the other hand. it stands beside a plate of partially-eaten food.","able air beside chew chews dish engineer finger food fork full hand make mouth mouthful plate recipe revers reverse sample something","",""
"286","Lostpropertybot","963131041375453185","intrepid robot which bravely enters the pile of classroom lost property to locate the precise item of apparel required to clothe a wailing child. (requestbot from @farnie)","https://pbs.twimg.com/media/DV25daVWkAA1PKx.png","a rounded, cylindrical robot with slim jointed arms and legs wearing a pith helmet and carrying a torch, with a rope and grapnel wound around the other arm. it is confronting a large pile of clothing with a look of wry determination on its face.","apparel child classroom cloth clothe clothing cylindrical determination enter enters face grapnel helmet intrepid item large locate look pile pith precis precise property rope slim torch wound","@farnie",""
"287","Deliverypersonbot","963317776332066817","when someone approaches your door to deliver post or a parcel, distracts your dog to prevent them attacking their shoes. (requestbot from @emmaloupitviper, slightly modified)","https://pbs.twimg.com/media/DV5kaI-XUAAkb-U.jpg","a conical robot with a flat top and a blinking antenna holding up a picture of a shoe in front of a dog.","antenna approach approaches attack attacking blink blinking conic conical dog flat front parcel picture prevent shoe shoes someone top","@emmaloupitviper",""
"288","Tyrebot","963392901790171136","changes your tyres for you. likes its work.","https://pbs.twimg.com/media/DV6ou1YX0AAYWq6.jpg","a round-topped, conical robot pushing along a car tyre and whistling. it has a little pocket built into its back which holds a couple of wrenches.","car chang changes conic conical couple like likes pocket round tyre tyres whistling work wrench wrenches","",""
"289","Cuddlebot","963496552865128448","a development spun-off from the hugbot program suite, cuddlebot is a giver of long, continuous cuddles rather than singular hugs. very snuggly and warm. (requestbot from @sosleepy_lars)","https://pbs.twimg.com/media/DV8F_HVXcAEstC5.png","a spherical robot with thick, banded arms and legs. it stands on the ground with its arms stretched wide, looking upwards with a smiley face near the top of its body.","body continuous cuddles develop development face giver ground hug hugbot hugs program singular smiley spheric spherical spun suit suite thick top upward upwards warm wide","@sosleepy_lars",""
"290","Valentinesbot","963693682934165506","if you're single on february 14th, supports you with an occasional squeeze of the hand and also sticks its tongue out at any disgustingly happy couples it sees. (requestbot from @floweroflondon)","https://pbs.twimg.com/media/DV-6Sy0W4AERcmH.jpg","a heart-shaped robot holding someone's hand as it frowns and sticks out its little tongue.","couples february frown frowns hand happy heart occasion occasional see sees single someone squeeze stick sticks tongue","@floweroflondon",""
"291","Mousebot","963764689498001408","keeps mice in the bits of your house you don't go into and out of the places where you they might crawl over your face while you sleep etc. (requestbot from @yarnsniffer)","https://pbs.twimg.com/media/DV_63ylW0AEJJLw.jpg","a rounded, trapezoid robot holding up a sign with a picture of a mouse's head with a line through it in one hand, while the other is raised as if halting something. it has an annoyed expression on its face.","annoy annoyed bit bits etc express expression face hand head house keep keeps line mouse picture place places sign sleep something trapezoid","@yarnsniffer",""
"292","Hagglebot","963855605470498816","a brave robot that is able to haggle in situations when it's appropriate to do so. very, very determined.","https://pbs.twimg.com/media/DWBNKx2WkAAcDUw.png","a flattish trapezoid robot with an angry, yelling face, holding a price tag labelled £50 that is attached to an antique dining chair.","able angry antique appropriate brave chair face flattish haggle price situations tag trapezoid","",""
"293","Backingbot","964043438948745216","sings the backing vocals for your overly-ambitious shower performances. its voice and talent level are calibrated based on how you sound in your own head. (requestbot from @joosylemon)","https://pbs.twimg.com/media/DWD4ZZWXUAAsCT3.jpg","an ovoid robot with a big, round open mouth and its eyes closed as it sings musical notes. its feet are firmly planted and its arms held out.","ambitious big eye eyes feet head level mouth music musical note notes open ovoid perform performances round shower sing sings sound talent vocal vocals voice","@joosylemon",""
"294","Jigsawbot","964113361674924032","puts away part-completed jigsaw puzzles and can then reassemble them exactly as they were. note that it can't complete a jigsaw by itself: it's just for saving your progress. (requestbot from @aoife_bear)","https://pbs.twimg.com/media/DWE3_cHWsAEED2X.jpg","a spherical robot held aloft by a propeller, with four long, thin jointed arms. three of its hands are working on a few sections of a partiality-assembled jigsaw while the fourth is reaching into a box of pieces labelled ""5437 piece jigsaw"" on one side and ""east-anglia sky"" on the other. the robot has an expression of intense concentration with its little tongue sticking out.","anglia box concentration east express expression fourth hand hands intense jigsaw note part partial partiality piece pieces progress propel propeller puzzles reassemble section sections side sky spheric spherical stick sticking thin tongue","@aoife_bear",""
"295","Pencilbot","964226633434615812","organises pencils by colour so they're easy to retrieve if you're a person who likes to make coloured notes, like @liz_bot2211. (requestbot from @helenmt)","https://pbs.twimg.com/media/DWGd-NBWkAEZvqY.png","a little ovoid robot sitting on the ground with some pencils in one hand and a eat line of pencils lying next to it. it has an expression of concentration with its tongue sticking out as it works.","colour coloured concentration easy eat express expression ground hand like likes line next note notes organises ovoid person retrieve tongue work works","@helenmt @liz_bot2211",""
"296","Crowdbot","964423517872652288","when you're on your own and have to speak in public or meet a lot of new people, sits in your pocket to keep you company and reassure you. (requestbot from @richardjattew)","https://pbs.twimg.com/media/DWJSExaVQAA_PkY.jpg","a tiny round robot in the breast pocket of a jacket, positioned with its arms hanging out over the side and its little smiley face poking out.","breast company face jacket meet new people pocket poke poking public reassure round side smiley speak tiny","@richardjattew",""
"297","Bugbot","964477061028073472","finds interesting bugs and carefully brings them over for you to see, then puts them back safely.","https://pbs.twimg.com/media/DWKCxfuX4AAqOCD.jpg","a robot with a rounded top and thick, banded arms and legs cradling a ladybird in one hand and tugging at someone's clothing with the other. it has a pleased expression on its face as it looks down at its discovery.","bring brings bug bugs cloth clothing discovery express expression face find finds hand ladybird pleas pleased someone thick top","",""
"298","Burpbot","964569237716197378","if you've got some trapped wind, can administer a series of light, percussive blows to your back to induce eructation.","https://pbs.twimg.com/media/DWLWm6HW0AAj8_f.jpg","a low, dome-shaped robot on four small wheels. a hinged arm like a crane extends from its back with various wires and bolts connecting the three segments and a flat, rectangular paddle perpinducular to the arm at the end, on the front of which are four soft, rounded pads. the robot's face is at the front of its base unit and it looks very happy.","administer arm base blow blows bolt bolts crane end eruct eructation extend extends face flat front happy light low pad paddle pads percuss percussive perpinducular rectangular segment segments series soft unit various wheel wheels wind wire wires","",""
"299","Unsubscribebot","964776637987545088","hits unsubscribe on all the e-mails you get from companies you bought a composter from, like, one time five years ago. (requestbot from @conorconneally)","https://pbs.twimg.com/media/DWOTPH_W0AAPYa1.jpg","a round robot sitting at a desk pressing the left mouse button on a laptop with one of its thin, jointed arns. its resting on its other hand, placed where its chin would be, and has a look of bored resignation on its face.","arns bore bored button chin companies desk email face hand hit hits mail mails mouse press pressing resign resignation round thin time unsubscribe year years","@conorconneally",""
"300","Conflictbot","964922595077443585","negotiates conflicts between small robots whose programming leads them to perform mutually exclusive tasks.","https://pbs.twimg.com/media/DWQWY8UXcAAnYON.png","a rounded, cylindrical robot with banded arms and legs and a small antenna on its top. it's standing between an angry-looking spiderbot and bugbot. spiderbot is holding its sign, pointing meaningfully at the arrow, while bugbot holds out a spider. conflictbot is holding up a finger to spiderbot and a hand to bugbot, while saying something with an imploring look on its face.","angry antenna arrow bugbot conflict conflicts cylindrical exclusive face finger hand look negotiates perform sign something spider spiderbot task tasks top","",""
"301","Lastbot","965146909680787459","always picked last to play sports, so you don't have to be.","https://pbs.twimg.com/media/DWTj_0DX0AARVXc.jpg","a spherical robot on two long, thin, jointed legs and with no arms standing on some grass in a row of people. it has a glum expression on its face.","express expression face glum grass joint jointed last people play row spheric spherical sport sports thin","",""
"302","Panicbot","965267390148866049","set up a cordon around you when you have a panic or anxiety attack to give you the space you need. (requestbot from @joi_the_artist)","https://pbs.twimg.com/media/DWVQe7sX0AMwmq3.png","five robots in the form of little traffic cones, each with four small legs on their undersides. they have serious expressions on their faces.","anxiety attack cone cones cordon express expressions form give need panic serious space traffic undersides","@joi_the_artist",""
"303","Reccybot","965495146690351105","goes and scouts out new places (gyms, restaurants, offices, schools, etc.) so you'll know where to go, how service works, which doors to use, what accessibility needs aren't addressed and so forth. (requestbot from @abradypus)","https://pbs.twimg.com/media/DWYgtv2W4AAVo4P.jpg","a round robot with a thoughtful expression writing in a small notebook.","access accessibility door doors express expression forth gym gyms new notebook offices place places restaurants round school schools scout scouts service thought thoughtful work works","@abradypus",""
"304","Tissuebot","965568245695729664","reminds you to take the toilet roll you just bought into the bathroom with you, rather than leaving it there on the kitchen counter *again*. (requestbot from @mrtumshie)","https://pbs.twimg.com/media/DWZjMpzXkAAY4ZQ.jpg","a round robot standing on a counter with an alarmed expression on its face as it opens its mouth to call out. it is holding up a toilet roll larger than itself and overbalancing slightly in its haste.","bathroom call counter express expression face haste kitchen larger remind reminds roll round toilet","@mrtumshie",""
"305","Specsbot","965676386387156993","one stays with your glasses, one stays with you, and when you need to find your glasses they wave at each other and lead you to them. (requestbot from @raamdu)","https://pbs.twimg.com/media/DWbFjVbX0AMW-HQ.jpg","two little round robots, one standing by a pair of glasses in a nook, one across a gap on a counter, happily waving at each other.","across counter gap glass glasses lead pair round stay stays","@raamdu",""
"306","Phobebot","965854889111846912","feel confident going out in the world as your queer self with this robot that hovers by you and flicks anyone who makes homophobic or transphobic comments in the head.","https://pbs.twimg.com/media/DWdn5k9X0AAPSa6.jpg","a spherical robot with a propeller on its top and a single flexible, banded arm on its underside ending in a hand that's poised about to flick something. the robot has an angry expression on its face.","angry anyone arm comment comments confident express expression face flexible flick hand head homophobic hover hovers propel propeller queer self single something spheric spherical top transphobic underside world","",""
"307","Lockbot","965930847957372928","no need to constantly second-guess yourself about whether you remembered to lock your door when you went out because this small robot gives you a live satellite feed of it to check throughout the day.","https://pbs.twimg.com/media/DWes-98XkAAB-s6.jpg","an oblong robot with a curved top that has a little satellite dish poking out of it and four small wheels on its underside. below its smiling face on its front is a square screen showing a view of a front door.","check day dish door face feed front guess live lock need remembered satellite screen second square top view wheel wheels","",""
"308","Notouchingbot","966025319894470657","if you're a person who is uncomfortable with physical contact for whatever reason, deploy this robot to keep away strangers who may not understand your needs at arm's length. (requestbot from @sosleepy_lars for @honeytoastliz)","https://pbs.twimg.com/media/DWgCeQLXcAA153z.png","a spherical robot standing in front of someone with its fists clenched and its little feet planted firmly on the ground. it has a big, wide mouth full of pointed teeth and angry eyes.","angry arm big contact deploy eye eyes feet fist fists front full ground length mouth need needs person physic physical reason someone spheric spherical stranger strangers teeth uncomfortable wide","@honeytoastliz @sosleepy_lars",""
"309","Batterybot","966218462782779393","when a battery runs out unexpectedly and you don't have a replacement to hand, plugs one or more of its many appendages in to provide temporary power from its own supply.","https://pbs.twimg.com/media/DWiykWgX4AEAMZp.jpg","a squat, cylindrical robot with two short legs and multiple banded cords sprouting from its top, waving and curling in all directions. the cords are tipped by battery-shaped connectors of various sizes, attached perpendicularly. the robot seems very pleased with itself.","appendages battery connector connectors cord cords cylindrical direct directions hand many pleas pleased power replacement run runs short size sizes squat supply temporary top various","",""
"310","Coasterbot","966293627520667648","waddles back and forth across the table just below any hovering drinks and catches them wherever they're placed down with a contented sigh as it folds its legs away.","https://pbs.twimg.com/media/DWj27bZWsAE9tPI.jpg","a disc-shaped robot with a happy face on its edge and four little banded legs on its underside.","catch catches content contented disc drink drinks face fold folds forth happy sigh table waddles","",""
