"540","Stonebot","1011869348091265024","for de-stoning tricky fruits.","https://pbs.twimg.com/media/DgrhzsvX4AEv4XZ.jpg","a spherical robot held aloft by a propeller on its top, with a single limb on its bottom that ends in a large, grabbing claw. it's hovering over a halved avocado, its claw just about to close on the protruding stone, with an expression of intense concentration, complete with sticking out tongue.","aloft avocado bottom claw complete concentration express expression fruit fruits halved intense large limb propel propeller single spheric spherical stone tongue top tricky","",""
"541","Waiterbot","1014417557158334464","brings your food.","https://pbs.twimg.com/media/DhPvY8FX0AAuyuN.jpg","a robot in the form of a plate with a silver cloche on top of it. it has four legs on the bottom and two arms on the cloche section. one arm has a serving towel draped across the wrist while the other is reaching to the cloche section's handle as if about to lift it off. the robot is wearing a black bowtie and its face, which is on the front of the cloche, is composed in a dignified pout with eyes closed.","black bottom bowtie bring brings cloche eye eyes face food form front handle lift plate section serving silver top towel wrist","",""
"541","Gigbot","1011943167061569536","helps you to see at gigs if you are a small person. (requestbot from @thedobletoffire)","https://pbs.twimg.com/media/DgsknGoX0AA4W9L.png","a spherical robot on three tall legs, with someone sitting on top of them to see over a large crowd of people. it's holding its hands out as if steadying its passenger and looks worried.","crowd gig gigs hand hands help helps large passenger people person see someone spheric spherical tall top","@thedobletoffire",""
"542","Hopperbot","1014504030113009664","a big, bouncy pal you can use as a highly-inefficient means of conveyance.","https://pbs.twimg.com/media/DhQ-CWYX0AAFpVr.jpg","a robot shaped like a space hopper, with a big, spherpid body and two little arms sticking out of the top where its handles should be. it's in mid-bounce and looks extremely happy.","big body bounce bouncy convey conveyance handles happy hopper inefficient mean means mid pal space spherpid top use","",""
"542","Nobot","1012235983100792832","counterparts to metabot - the small robots that tell you what to do if the small robot you're asking for doesn't exist yet.","https://pbs.twimg.com/media/DgwvQrCW4AA7n2h.jpg","two smiling round-topped robots, each holding a sign. the first reads (in mixed-case, occasionally backwards letters): ""no we don't have a robot like that..."" and the second continues: ""but if you think it wud b gud reqest [sic] it by dm!!!""","b backward backwards case counterpart counterparts dm first gud letter letters mix mixed read reads reqest round second sic sign tell wud","",""
"543","Fliesbot","1014764213481476097","waits outside the door in situations where you might drop or remove your trousers and, upon your emergence, alerts you if your flies are still open.","https://pbs.twimg.com/media/DhUqrBpWsAAujvm.jpg","a round robot looking alarmed and waving frantically as it stands on a tiled floor. a door with significant clearance from the floor is visible and someone's shoe is just coming into frame. the robot is pointing upwards.","clearance door emergence flies floor frame outside round shoe significant situations someone tile tiled trouser trousers upward upwards visible wait waits","",""
"543","Oncobot","1012298023156768769","[cn: cancer] supports you throughout your diagnosis and treatment for cancer. stays close by for therapies, is always gentle and understanding, stays as long as you need because it knows that recovery isn't black and white. (requestbot from @thefaithcaton)","https://pbs.twimg.com/media/Dgxnr6TW4AEAumG.jpg","a spherical robot with a sympathetic smile, gently holding someone's finger.","black cancer cn diagnosis finger gentle know knows recovery smile someone spheric spherical stay stays sympathetic therapies treatment understand understanding white","@thefaithcaton",""
"544","Filesbot","1014833791179816960","for all your office organisation needs. very good at the alphabet and immune to paper cuts.","https://pbs.twimg.com/media/DhVp80qW0AAeKzo.jpg","a spherical robot held aloft by a propeller on its top, with jointed arms and a shirt collar around its neck/waist from which a striped tie is suspended. it has a file tucked under one arm while its free hand rifles through an open file cabinet drawer.","aloft alphabet cabinet collar cut cuts drawer file free good hand immune neck need needs office organisation paper propel propeller rifles shirt spheric spherical tie top waist","",""
"545","Handsbot","1015145958047473665","need a spare hand to help hold something? here's six! (requestbot from @aguitarpenter)","https://pbs.twimg.com/media/DhaF3iuX4AELe0-.jpg","a dome-shaped robot with four wheels on its base and six long, jointed arms set along its side. all of its fingers are wiggling in anticipation.","anticipation base dome finger fingers hand help need side something spare wheel wheels","@aguitarpenter",""
"546","Hembot","1015210369088937984","a surprisingly weighty robot that holds onto the hem of your skirt to prevent it being blown or rucked up. (requestbot from
@rhiannnnonay)","https://pbs.twimg.com/media/Dha_CTuXcAIW2gT.png","a round-topped robot hanging down from the bottom of a skirt with a grumpy expression on its face.","bottom express expression face grumpy hem prevent round skirt weighty","@rhiannnnonay",""
"547","Hottoastbot","1015978120225218560","a robot that hangs around in museums, illuminating things. also likes to offer hot toast, ideally covered with marmite.

yes, the winner of #followerbot5000 is @hot_toast! congratulations!","https://pbs.twimg.com/media/Dhl6OnAW0AAmh0q.png","a robot shaped like a lamp shade, with a conical bottom section and cylindrical top section. its face is on the conical part and it has two banded legs and the bottom and banded arms on either side of its face,","bottom congratulations conic conical cylindrical face hang hangs hot lamp marmite museum museums offer part section shade side thing things toast top winner","@hot_toast","#followerbot5000"
"548","Toohotbot","1016210593588699137","lets you know that it's too hot. (requestbot from @emmah_h)","https://pbs.twimg.com/media/DhpOJbUX0AAa1so.jpg","an ovoid robot yelling and pointing as it gestures towards a wall-mounted thermometer. it has two beads of sweat on its forehead.","bead beads forehead gestures hot let lets ovoid wall","@emmah_h",""
"549","Helmetbot","1016285393191428096","if you insist on operating high-speed motor vehicles, does what it can to keep your head in as few pieces as possible.","https://pbs.twimg.com/media/DhqSLRaWkAI4tvy.jpg","a robot in the form of a motorcycle helmet, throwing its arms backward in exultation as it's carried forward.","carried exult exultation form forward head helmet high insist motor motorcycle pieces possible speed vehicles","",""
"550","Summarybot","1016575873737281538","perches on your shoulder in social situations and gives you a quick summary of what's going on if you've been distracted or it's all a bit overwhelming. doesn't have a long-term storage function. (requestbot from @lmhphotog)","https://pbs.twimg.com/media/DhuaXYgW4AAXrL6.jpg","a round-topped robot sitting on someone's shoulder, hand raised to its face as if making an aside to them.","bit face function hand long overwhelm overwhelming perch perches quick round shoulder situations social someone storage summary term","@lmhphotog",""
"551","Abolishicebot","1016648139607105536","for melting ice. it hates ice. in fact, it wants to abolish ice. please, abolish ice.","https://pbs.twimg.com/media/DhvcF8RX0AAVVmB.jpg","a dome-shaped robot on four wheels with two arms on either side. instead of a mouth it has a large grill which blasts heat and is currently melting a small chunk of ice into a puddle. its fists are clenched and it looks very angry.","abolish angry chunk dome fact fist fists grill heat ice large mouth pleas please puddle side wheel wheels","",""
"552","MrTeabot","1016790099764408322","a teabot variant that pities the fool who don't drink tea. like all teabots, it won't accept any other beverage except, in this case, milk for some reason. don't even try to take it abroad on holiday with you, unless you go by boat.","https://pbs.twimg.com/media/DhxcxZ3X0AAldht.png","teabot - a robot mug of tea with caterpillar tracks on either side - but with the addition of a beard, a little wedge of mohawk on the rim and gold chains around its lower section. unlike normal teabot, this version looks quite angry.","addition angry beard beverage boat case caterpillar chain chains gold holiday lower milk mister mohawk mr mug normal pities reason section side tea teabot teabots track tracks variant version wedge","",""
"553","Botwhispererbot","1016938896582639616","the human-robot interface you need to convey your mumbled commands to the inferior devices produced by less exacting manufacturers. (requestbot from @chizangiam)","https://pbs.twimg.com/media/DhzkiOlW0AEv8QG.jpg","a robot shaped like a squat, rounded sphere, kneeling beside an amazon echo, holding out its hands imploringly as it frowns at the truculent machine.","amazon beside command commands convey devices echo frown frowns hand hands human inferior interface less machine manufacturers squat truculent","@chizangiam",""
"554","Canringbot","1017011775034798080","pulls apart can rings prior to disposal so they don't entangle wildlife.","https://pbs.twimg.com/media/Dh0m0UGWsAECyO4.jpg","an angry robot shaped like a rounded cylinder, pulling apart a loop in a plastic four-pack ring.","angry cylinder entangle pack plastic pull pulls ring rings round rounded wildlife","",""
"555","Threelionsbot","1017311127590658050","really wanted their team to be in the final.","https://pbs.twimg.com/media/Dh43EzUX4AApMIj.jpg","three robots designed to look like anthropomorphic lions wearing football shirts and boots. one is sitting slumped with its head resting on its folded arms, one is sitting down looking miserable and one is on its knees crying in despair, shaking its fist at the skies.","anthropomorphic boot boots despair final fist fold folded football head lion lions miser miserable shirt shirts skies sky team want wanted","",""
"556","Giftbot","1017371641582686208","feeling low? most of the time giftbot is nowhere to be found but now and then, when it senses you need it most, it shows up with a little present for you. could be a book it thinks you might enjoy, could be a pretty rock it found, anything.","https://pbs.twimg.com/media/Dh5uHSHWsAEPSk_.jpg","a round robot with banded arms and legs, smiling and proffering a gift-wrapped box.","anything book box gift giftbot low present rock round sens senses think thinks time","",""
"557","Trollbot","1017659591902093313","not the kind with a lot of numbers in its name and an anime avatar. instead, guards your valuable bridges from trespassing billy-goats.","https://pbs.twimg.com/media/Dh9z_8TX4AACJyS.jpg","a stone humpback bridge spanning a river, with a large round robot peering out from beneath the near end, one hand gripping the bridge's underside, the other submerged in the water. it's grimacing and showing off pointed teeth and has two little horns, banded like its arms.","anime avatar beneath bridge bridges end goat goats guard guards hand horn horns humpback kind large lot number numbers river round show showing stone submerged teeth underside valuable water","",""
"558","Saltbot","1017732640970067969","558/9) salt- and pepperbots. bring you salt and pepper.","https://pbs.twimg.com/media/Dh-2cS4XcAEzTMu.jpg","two robot salt and pepper shakers, each with two little jointed legs on their bases. pepperbot has several grains floating out of its top and is sneezing so hard its flying off its feet. a speech bubble is coming from its mouth saying 'achooo!!!' while saltbot looks on, concerned.","base bases bubble feet grain grains hard look looks mouth pepper pepperbots salt saltbot sever several shaker shakers speech top","",""
"559","Pepperbot","1017732640970067969","558/9) salt- and pepperbots. bring you salt and pepper.","https://pbs.twimg.com/media/Dh-2cS4XcAEzTMu.jpg","two robot salt and pepper shakers, each with two little jointed legs on their bases. pepperbot has several grains floating out of its top and is sneezing so hard its flying off its feet. a speech bubble is coming from its mouth saying 'achooo!!!' while saltbot looks on, concerned.","base bases bubble feet grain grains hard look looks mouth pepper pepperbots salt saltbot sever several shaker shakers speech top","",""
"560","Barbecuebot","1018748927099711494","whooooo wants burgers?!","https://pbs.twimg.com/media/DiNSv2OX0AEPtsv.jpg","a robot in the form of a bowl-shaped barbecue, with four banded legs and two arms, one holding a long barbecue fork and the other holding a set of tongs. the robot is smiling happily with its eyes closed as it gestures with its fork towards its smoking grill.","barbecue bowl burger burgers eye eyes fork form gestures grill tongs towards whooooo","",""
"561","Offbot","1018822072481566721","helps those with a reduced or absent sense of smell determine if foodstuffs have gone bad. (requestbot from @nixnameweilbaum)","https://pbs.twimg.com/media/DiOVRgGX0AEiJ3Y.jpg","an ovoid robot lifting open a pack of sliced meat that us surrounded by flies. the robot is screwing its face up and sticking out its tongue as it makes a thumbs-down gesture with its free hand.","absent bad determine face flies free gesture hand help helps meat open ovoid pack sens sense smell thumb thumbs tongue","@nixnameweilbaum",""
"562","Viewbot","1019113743156989953","if the view from your window is a bit grim, sidles onto the ledge outside and projects a more aesthetically pleasing one.","https://pbs.twimg.com/media/DiSein3X4AA6J6V.jpg","a window with a large, flat robot pressed up against it. the view behind it consists of dark factories and smog, while the robot itself has a screen on its surface showing an idyllic lagoon, complete with bigbot stepping ashore in the background.","background bigbot bit complete dark factories flat grim idyl idyllic lagoon large ledge outside project projects screen sidles surface view window","",""
"563","Wheeliebot","1019184722457579523","if you're struggling to move your heavy wheelie-bin, substitute it for this self-propelled version! compatible with all vehicle loading mechanisms and has a changeable exterior to match the required colours of your local authority. (requestbot from @acflory)","https://pbs.twimg.com/media/DiTfGdgXUAAzfix.jpg","a robot in the form of a plastic wheelie-bin, with two little arms on either side and a smiling face on the lower front.","author authority bin changeable colour colours compatible exterior face form front heavy local lower match mechanisms move plastic self side substitute vehicle version wheelie","@acflory",""
"564","Plaitbot","1019475255587430401","if you struggle to produce aesthetically pleasing plaits in your own or a child's hair, this robot can do it for you. most of the time.","https://pbs.twimg.com/media/DiXnVwoW0AA1fTw.jpg","a spherical robot held aloft by a propeller on its top, with four jointed arms. three of its hands are entwined in the tresses of a child's hair while the other holds a hairbrush. the robot looks slightly perplexed by the many strands it has looped around its fingers.","aloft child entwined finger fingers hair hairbrush hand hands many perplex perplexed plait plaits propel propeller spheric spherical strand strands struggle time top tress tresses","",""
"565","Dragonbot","1019548104868188161","a robot dragon friend. collects 'treasure' for its hoard in the form of random household junk it likes the look of. a bit bitey.","https://pbs.twimg.com/media/DiYpl_jXcAAe5Wr.jpg","a robotic dragon with a large spherical body and an pvoid head with a large, fang-filled mouth. it has little wings and a barbed tail and is sitting on a heap containing magazines, envelopes, a child's drawing, a usb cord, a bottle cap, a lego brick, a cd, a paperclip, a hairband and a nail file.","bit bitey body bottle brick cap cd child cord dragon draw drawing envelop envelopes fang file form friend hairband head heap hoard junk large lego like likes magazines mouth nail paperclip pvoid random robot robotic spheric spherical tail treasure usb wing wings","",""
"566","Drumbot","1019836378534858752","bang bang bang do you like noises??? bang bang bang","https://pbs.twimg.com/media/Dicvx38WAAEEETy.jpg","a robot in the form of a drum, with drumsticks in its hands, beating the top of its head which is the drum's skin. its eyes are screwed shut and its mouth is open in a joyous yell.","bang drum drumstick drumsticks eye eyes form hand hands head joyous mouth noises open shut skin top yell","",""
"567","Chimneybot","1019910126499713024","keeps your chimney spick and span. cheery cockney demeanour can be switched off if desired.","https://pbs.twimg.com/media/Didy2lAXkAAy2Pq.jpg","a spherical robot with jointed arms and legs, carrying a long chimney brush over one shoulder as it walks along, whistling cheerily. it's wearing a shapeless peaked cap and is covered in smears of soot.","brush cap cheery chimney cockney demeanour keep keeps long shapeless shoulder smear smears soot span spheric spherical spick walk walks","",""
"568","Bibot","1020200242631913472","swings into action to correct misconceptions about bisexuality. no, it's not a phase. yes, you're ""still bi"" in a monogamous relationship. no, it doesn't exclude gender-non-conforming people. then swings away again. (requestbot from @stillicides)","https://pbs.twimg.com/media/Dih6tgSX4AA6cGE.jpg","a spherical robot suspended on a long cable, swinging into view waving a bisexual flag and angrily pointing and gesticulating.","action bisexual bisexuality cable flag misconceptions monogamous non people phase relationship spheric spherical swing swings view","@stillicides",""
"569","Juicebot","1020270715445088256","fruit goes in, juice comes out. what's not to love?","https://pbs.twimg.com/media/Dii6zpAWkAAIu0K.jpg","a rounded cuboid robot with an angled funnel on its top into which it is tossing a handful of mixed berries. it has a big wide smile from which is issuing a gushing stream of juice, splashing into a glass it is holding in its other hand.","berries big cuboid fruit glass hand handful juice love mix mixed smile stream top wide","",""
"570","Teddybot","1020548831958781953","soft fren.","https://pbs.twimg.com/media/Dim3wJpX4AEgD74.jpg","a robot in the form of a teddy bear, holding its big fuzzy paws out for a hug.","bear big form fren fuzzy hug paw paws soft teddy","",""
"571","Gluebot","1020621375348854785","dispenses glue and assists in sticking together fiddly stuff you've broken or need to assemble.","https://pbs.twimg.com/media/Din5usiXsAAkM8o.jpg","a robot transparent bottle of superglue with a top-mounted nozzle. it has jointed limbs and is in the process of sticking a shoulder pad to a warhammer 40,000 space marine miniature, its tongue sticking out in concentration.","assemble assist assists bottle concentration dispenses joint jointed limb limbs marine miniature need pad process shoulder space stuff superglue tongue top transparent","",""
"572","Pipebot","1020936746106793984","affect an air of sophistication at the gentlemen's club with this tobacco-free pipe pal.","https://pbs.twimg.com/media/DisYjnuX0AEeqVC.jpg","a robot in the form of a traditional tobacco pipe, with its face on the bowl and two little legs underneath.","affect air bowl club form free gentlemen pal pipe sophist sophistication tobacco traditional underneath","",""
"573","Halfpipebot","1020987077935214592","avoid doing damage to local civic infrastructure when skating with this robot ramp.","https://pbs.twimg.com/media/DitGVZbWsAAEzsL.jpg","a robot half-pipe with three pairs of wheels along its long edges. its face is on the front, below the lowest point of the skating surface.","avoid civic damage edges face front half infrastructure local long lowest pair pairs pipe point ramp surface wheel wheels","",""
"574","Paleobot","1021382389694697472","helps dig up and categorise fossil remains. helps out over at @smoldinosaurs.","https://pbs.twimg.com/media/DiytlcoXUAA5FJL.png","an ovoid robot with jointed arms and legs and a little stetson hat, kneeling over a fossilised bone, dusting it down with a little brush.","bone brush categorise fossil hat help helps joint jointed stetson","@smoldinosaurs",""
"575","Bollocksbot","1021648560444649473","need to fake it till you make it? let this robot bullshit its way through tough questions about stuff you don't really understand! has strict ethical protocols though, so can only be used for trivial purposes.","https://pbs.twimg.com/media/Di2f8tgWwAAmPnN.jpg","an ovoid robot holding out its hands as it cheerfully emits a speech bubble that has a complicated diagram of how something labelled ""tidal drive"" functions.","bubble bullshit diagram drive ethic ethical function functions hand hands ovoid protocol protocols purposes question questions something speech strict tidal tough trivial way","",""
"576","Highnotebot","1021723820141494274","a backingbot variation that exceeds your singing ability to hit those tricky high notes. glassbot is not a fan... (requestbot from @fatcalfmedia)","https://pbs.twimg.com/media/Di3kZc2WwAEFuMD.jpg","an ellipsoid robot with its eyes closed and its arms outstretched, singing a high note. in the background, a wine glass on a shelf is exploding as glassbot looks up from the floor in dismay.","ability background backingbot dismay ellipsoid eye eyes fan floor glass glassbot high look looks note notes shelf tricky variation wine","@fatcalfmedia",""
"577","Traumabot","1022010215741497345","knows your triggers and can review media ahead of time and provide appropriate content notes to allow you to prepare appropriately.","https://pbs.twimg.com/media/Di7o3woXcAAfgGu.jpg","a round-topped robot with a serious face sitting on the edge of a sofa, a book in one hand and a tv remote in the other.","appropriate book content edge face hand know knows media note notes prepare provide remote round serious sofa time trigger triggers tv","",""
"578","Retortbot","1022080288522944513","if you're stunned into silence or otherwise shaken up by a thoughtless or cruel remark, retortbot jumps out to properly articulate your rage. (requestbot from @wordspixgal)","https://pbs.twimg.com/media/Di8omipXgAIaQPC.jpg","an angry, cuboid robot, pointing and yelling as it steps forward.","angry articulate cruel cuboid jump jumps rage remark retortbot shaken silence step steps thoughtless","@wordspixgal",""
"579","Crowdfundingbot","1022373498797416448","do you have a project you're trying to promote or a cause you want to raise awareness of? this robot can help get your message out there.","https://pbs.twimg.com/media/DjAzRuqXgAAcM1e.jpg","a spherical robot held aloft by a propeller on its top, with a long banner trailing out behind it that says ""your text here"". the robot has a determined expression on its face and is pointing forward.","aloft awareness banner cause express expression face help long message project promote propel propeller raise spheric spherical text top","",""
"580","Fatbot","1022446579754692608","oh, fatshaming someone, were you? thought you'd say something because you were ""just concerned about their health"". well fuck you. tell it to fatbot and get a track to the face, you dickhead. (requestbot from @applewriter)","https://pbs.twimg.com/media/DjB1vlDXgAA7bg7.jpg","a large, pear-shaped robot mounted on two caterpillar tracks, with two banded arms raised in fists and an angry little face near the top of its body.","angry body caterpillar concern concerned d dickhead face fatbot fist fists fuck health large pear someone something thought top track tracks","@applewriter",""
"581","Thommybot","1022736095434485761","a very smol, shy robot that feels weird you're looking at it now. #newprofilepic","https://pbs.twimg.com/media/DjF9DgMXcAAHSNo.jpg","a round-topped robot with four stumpy little legs on its base, like notokaybot. instead of an antenna it has a little ponytail on its back and it's wearing glasses. its expression is anxious.","antenna anxious base express expression feel feels glass glasses round shy smol stumpy wear wearing","","#newprofilepic"
"582","Emmabot","1022807400003383296","an extremely talented robot with many interesting hobbies. good at making thommybot feel less smol.","https://pbs.twimg.com/media/DjG96DiWwAAkRRB.jpg","a smiley, spherical robot with a little ponytail and freckles on its chubby cheeks. it's holding out its arms for a hug.","cheek cheeks feel freckles good hobbies hug interest interesting many ponytail smiley smol spheric spherical thommybot","",""
"583","Mondaybot","1023822777596428288","if you're feeling a bit glum on a monday morning, mondaybot will drop by to keep you company and just generally cheer you up by being a small round pal.","https://pbs.twimg.com/media/DjVZY1dX0AMhQY9.jpg","a spherical robot with a little smiley face, short stumpy legs and a little antenna on top.","antenna bit company drop face glum monday morn morning pal round short smiley spheric spherical stumpy top","",""
